{
  "id": "transcript-scorecard",
  "title": {
    "en": "Transcript Scorecard — incremental call evaluation",
    "zh": "Transcript Scorecard — 实时客服通话质检"
  },
  "summary": {
    "en": "A proof of concept replays fictional support-call transcripts incrementally. Each enabled criterion contributes a Score and a Choice selecting an evidence sentence; code normalizes and weights the results, then stores the final evaluation in SQLite.",
    "zh": "概念验证项目逐句重放虚构客服通话文本。每个启用维度对应一个 Score 和一个选择证据句的 Choice，由代码归一化、加权，并将最终评估存入 SQLite。"
  },
  "category": "productivity",
  "task": "decision",
  "input_type": [
    "text"
  ],
  "jev_primitive": [
    "choice",
    "score"
  ],
  "software_action": [
    "score",
    "review"
  ],
  "source_url": "https://github.com/brandonbryant12/transcript-scorecard",
  "evidence": {
    "level": "docs-reviewed",
    "verified_by_seeapi": false,
    "reviewed_at": "2026-09-18",
    "sources": [
      "https://github.com/brandonbryant12/transcript-scorecard",
      "https://github.com/brandonbryant12/transcript-scorecard/blob/c9232fffbf8bf23b7cf5402dd02ebc54b19eb9cf/apps/api/src/classifier.ts"
    ],
    "basis": "Existing repository review and linked documentation; metadata migration on 2026-09-20, no new runtime validation."
  },
  "limitations": {
    "en": [
      "This is transcript replay, not verified live audio recognition. Evaluations send the current transcript prefix to TypeSafe; costs can grow with the conversation. The documented local demo has no authentication. Scoring quality and timing were not reproduced."
    ],
    "zh": [
      "展示的是文本重放，不能视为已验证的实时语音识别。每次评估发送当前转写前缀，费用可能随对话增长；文档说明本地演示无认证。未复现评分质量或时延。"
    ]
  },
  "tags": [
    "support",
    "scorecard",
    "客服"
  ],
  "recipe_ids": []
}
